[
  {
    "id": "H1",
    "kind": "premium",
    "displayName": "Belladonna Philtre",
    "tierRank": 1,
    "substitutes": false,
    "appearsOnReels": [0, 1, 2, 3, 4, 5],
    "featureOnly": false,
    "assets": {
      "static": "img.symbol.h1.static",
      "win": "img.symbol.h1.win",
      "blur": "img.symbol.h1.blur"
    }
  },
  {
    "id": "H2",
    "kind": "premium",
    "displayName": "Serpent's Emerald",
    "tierRank": 2,
    "substitutes": false,
    "appearsOnReels": [0, 1, 2, 3, 4, 5],
    "featureOnly": false,
    "assets": {
      "static": "img.symbol.h2.static",
      "win": "img.symbol.h2.win",
      "blur": "img.symbol.h2.blur"
    }
  },
  {
    "id": "H3",
    "kind": "premium",
    "displayName": "Widow's Amber",
    "tierRank": 3,
    "substitutes": false,
    "appearsOnReels": [0, 1, 2, 3, 4, 5],
    "featureOnly": false,
    "assets": {
      "static": "img.symbol.h3.static",
      "win": "img.symbol.h3.win",
      "blur": "img.symbol.h3.blur"
    }
  },
  {
    "id": "H4",
    "kind": "premium",
    "displayName": "Moth-Wing Tonic",
    "tierRank": 4,
    "substitutes": false,
    "appearsOnReels": [0, 1, 2, 3, 4, 5],
    "featureOnly": false,
    "assets": {
      "static": "img.symbol.h4.static",
      "win": "img.symbol.h4.win",
      "blur": "img.symbol.h4.blur"
    }
  },
  {
    "id": "L1",
    "kind": "low",
    "displayName": "Mandrake Root",
    "tierRank": 5,
    "substitutes": false,
    "appearsOnReels": [0, 1, 2, 3, 4, 5],
    "featureOnly": false,
    "assets": {
      "static": "img.symbol.l1.static",
      "win": "img.symbol.l1.win",
      "blur": "img.symbol.l1.blur"
    }
  },
  {
    "id": "L2",
    "kind": "low",
    "displayName": "Nightcap Mushrooms",
    "tierRank": 6,
    "substitutes": false,
    "appearsOnReels": [0, 1, 2, 3, 4, 5],
    "featureOnly": false,
    "assets": {
      "static": "img.symbol.l2.static",
      "win": "img.symbol.l2.win",
      "blur": "img.symbol.l2.blur"
    }
  },
  {
    "id": "L3",
    "kind": "low",
    "displayName": "Black Lotus Pod",
    "tierRank": 7,
    "substitutes": false,
    "appearsOnReels": [0, 1, 2, 3, 4, 5],
    "featureOnly": false,
    "assets": {
      "static": "img.symbol.l3.static",
      "win": "img.symbol.l3.win",
      "blur": "img.symbol.l3.blur"
    }
  },
  {
    "id": "L4",
    "kind": "low",
    "displayName": "Wax Seal & Twine",
    "tierRank": 8,
    "substitutes": false,
    "appearsOnReels": [0, 1, 2, 3, 4, 5],
    "featureOnly": false,
    "assets": {
      "static": "img.symbol.l4.static",
      "win": "img.symbol.l4.win",
      "blur": "img.symbol.l4.blur"
    }
  },
  {
    "id": "L5",
    "kind": "low",
    "displayName": "Dried Foxglove Sprig",
    "tierRank": 9,
    "substitutes": false,
    "appearsOnReels": [0, 1, 2, 3, 4, 5],
    "featureOnly": false,
    "assets": {
      "static": "img.symbol.l5.static",
      "win": "img.symbol.l5.win",
      "blur": "img.symbol.l5.blur"
    }
  },
  {
    "id": "SCATTER",
    "kind": "scatter",
    "displayName": "The Parlour Seal",
    "tierRank": 10,
    "substitutes": false,
    "appearsOnReels": [0, 1, 2, 3, 4, 5],
    "featureOnly": false,
    "assets": {
      "static": "img.symbol.scatter.static",
      "win": "img.symbol.scatter.win",
      "blur": "img.symbol.scatter.blur"
    }
  },
  {
    "id": "MULT",
    "kind": "multiplier",
    "displayName": "Essence Orb",
    "tierRank": 11,
    "substitutes": false,
    "multiplierValues": [2, 3, 4, 5, 6, 8, 10, 12, 15, 20, 25, 50, 100],
    "appearsOnReels": [0, 1, 2, 3, 4, 5],
    "featureOnly": false,
    "assets": {
      "static": "img.symbol.mult.static",
      "win": "img.symbol.mult.win",
      "blur": "img.symbol.mult.blur"
    }
  },
  {
    "id": "FX1",
    "kind": "feature_exclusive",
    "displayName": "The Prisming Vial",
    "tierRank": 12,
    "substitutes": false,
    "appearsOnReels": [0, 3],
    "featureOnly": true,
    "assets": {
      "static": "img.symbol.fx1.static",
      "win": "img.symbol.fx1.win",
      "blur": "img.symbol.fx1.blur"
    }
  }
]
